Título,Hora,Fecha,Autor,Texto Completo,Categoría
"El estreno de la nueva calle Eduardo Barreiros se retrasa a otoño: tendrá dos carriles por sentido, más pasos de peatones y un carril bici",20:16h,05.04.2022,"
Belén Sarriá
 ","Las obras que comenzaron en la calle Eduardo Barreiros en mayo de 2021, y que deberían estar culminadas en mayo de este año, se retrasan finalmente a otoño. Se trata de una gran obra que afecta a un tramo de 1,5 kilómetros, entre la M-40 y la calle Alcocer, razón por la que el área que dirige Paloma García Romero justifica los retrasos. ""Para obras tan grandes como esta es complicado afinar el plazo, suele ser estimado porque van surgiendo cosas. Por ejemplo, en este caso se está actuando al mismo tiempo que están construyendo un colector, que discurre a lo largo de toda la calle y tiene que ir siendo ejecutado antes que la urbanización, con la complejidad que ello conlleva"", señala el área a 20minutos.
El proyecto para esta zona de Villaverde es el mismo que hace un año: transformar en vía urbana lo que ahora es una carretera de un carril por sentido. Es decir, pasar de una carretera sin aceras, zonas terrizas, y un único carril por sentido, en una calle adecentada y con dos carriles por sentido.
Otro de los inconvenientes que encuentran los vecinos a día de hoy es la escasez de cruces: tan solo existen seis puntos de cruce peatonal (cuatro de ellos con semáforo) situados de forma desordenada. Esto provoca que la distancia entre algunos de ellos sea de hasta 400 metros. Como solución, se crearán nuevos pasos con semáforos y aparcamientos a ambos lados de la calle, además de espacios para carga y descarga.
Asimismo, actualmente la canalización telefónica es aérea sobre postes y no existe red pública de alumbrado en toda la calle, tal y como explican desde el Ayuntamiento. Tras las obras, el peatón dispondrá de un espacio mejor ordenado, con unas dimensiones adecuadas y dotado de mobiliario urbano, nuevo arbolado y alumbrado público de alta eficiencia energética ahora inexistente. La remodelación supondrá también una mejora de la circulación del transporte público y del acceso a sus paradas, que dispondrán de sobreanchos de acera y pavimentos podotáctiles para un mejor acceso de todos los usuarios, sostiene el área de Obras.
Por último, la transformación incluirá la creación de un nuevo itinerario ciclista que permitirá conectar los distritos de Villaverde y Usera a través de un carril bici a lo largo de toda la calle. ""La remodelación de la calle Eduardo Barreiros supone una actuación de reequilibrio y cohesión territorial que permitirá mejorar sensiblemente la conexión de los distritos de Usera y Villaverde y dotará a los vecinos de este distrito de un nuevo eje urbano funcional y de gran calidad paisajística y ambiental"", concluyen desde Cibeles.",madrid
"Los estudiantes madrileños de Bachillerato sí estudiarán la Historia de España anterior a 1812: ""Al colegio no se va a ser adoctrinado""",19:08h,05.04.2022,"
Christian Morata
 ","La Comunidad de Madrid ha comunicado este martes que está ""totalmente en contra"" del Real Decreto sobre las enseñanzas mínimas de Bachillerato aprobado por el Gobierno central, y ha asegurado que ellos utilizarán su derecho para regular el 40% del currículo, incluyendo la Historia de España anterior a 1812. ""Al colegio no se va a ser adoctrinado"", ha asegurado.
Así lo ha señalado el consejero de Educación, Universidades y Ciencia y portavoz del Gobierno regional, Enrique Ossorio, después de conocer que el Consejo de Ministros ha aprobado la propuesta del Ministerio de Educación por el que se establece la ordenación y las enseñanzas mínimas de Bachillerato y, según la norma, el estudio de Historia de España de 2º se centrará en la etapa contemporánea, a partir de 1812.
""Esto no va a suceder en la Comunidad de Madrid. Nosotros ahora tenemos la posibilidad de regular el 40% del currículo"", ha señalado el consejero, quien ha destacado que la Comunidad incluirá ""las cuestiones que ellos (el Gobierno) no han querido poner"".
En concreto, cree que el no desarrollo de la asignatura de Historia es ""grave"" porque no incluye el descubrimiento de América, la Edad Media o los Austrias.
Para Ossorio, las enseñanzas mínimas para Bachillerato trazadas por el Gobierno central suponen ""menos conocimiento"", ""menos esfuerzo"" y están ""absolutamente impregnadas de ideología"". El consejero también ha transmitido su ""preocupación"" por la nueva modalidad de ""bachillerato general"", que calificó de ""descafeinado"" porque ""no va a servir para estudios posteriores"".
Por otro lado, y sobre Filosofía, ha criticado que el Gobierno que preside Pedro Sánchez esté ""intentando engañar"", ya que no ha incluido la asignatura ""en las 200 páginas que hay en el currículo de ESO"". ""En ningún momento aparece"", ha apostillado.
El consejero y portavoz ha subrayado que en la LOMCE era una de las asignaturas que aparecía en el currículo de manera optativa, mientras que ahora no está en el currículo estatal. ""No es de recibo que si una comunidad autónoma decide que no se estudie Filosofía, no se estudia"", ha aseverado.",madrid
"Un apagón eléctrico, un virus informático y un incendio: más de 50 personas participan en el simulacro de emergencia del Canal de Isabel II",18:01h,05.04.2022,"
Christian Morata
 ","Distintos efectivos de emergencias han realizado un simulacro a gran escala en la sede de Canal de Isabel II de Majadahonda para probar su capacidad de respuesta a una hipotética situación de crisis y emergencia en una instalación clave para el suministro de agua potable a la región. En este caso se ha provocado de manera ficticia un apagón eléctrico masivo, un ataque informático que obligaba a desconectar todos los equipos y un incendio en una galería de servicio de la instalación de la entidad pública.
Más de medio centenar de personas, entre profesionales de la empresa pública, bomberos, sanitarios o policías, ha participado en este ensayo que ha comprobado sobre el terreno la consejera de Medio Ambiente, Vivienda y Agricultura de la Comunidad de Madrid, Paloma Martín, acompañada por el viceconsejero de Interior y director de la Agencia de Seguridad y Emergencias Madrid ASEM 112, Carlos Novillo.
Canal de Isabel II ha activado a lo largo de la jornada, bajo la coordinación de un Comité de Continuidad con miembros de catorce áreas, trabajos que han permitido el correcto funcionamiento de las instalaciones y la recuperación de todos sus servicios.
Entre ellos se han movilizado sistemas alternativos de suministro eléctrico para priorizar las principales actividades como la potabilización del agua y de abastecimiento con el objetivo de garantizar las infraestructuras.
En cuanto al supuesto ataque informático, los profesionales de emergencia se han visto obligados a poner en funcionamiento protocolos alternativos que han hecho posible continuar monitorizando la actividad de esta instalación, al tiempo que se procedía a contener y eliminar el virus. A la par, y con el fin de comprobar también la coordinación con agentes de emergencia en situaciones de peligro para los empleados o la población, se ha simulado un incendio.
ASEM 112 ha instalado un Puesto de Mando Avanzado (PMA) desde el que el Cuerpo de Bomberos y el SUMMA han intervenido para rescatar y atender médicamente a dos empleados de la compañía que simuladamente habían quedado atrapados en un espacio confinado. También han estado presentes efectivos de la Policía Local de Majadahonda.
Martín ha destacado que con este simulacro se ha puesto a prueba las capacidades del Canal para situaciones de emergencia. ""Lo que hemos visto es una respuesta al máximo nivel, con total profesionalidad y solvencia pro parte de todos los trabajadores, que nos ha permitido mantener la continuidad del servicio, lo más importante para este tipo de simulacros"", ha dicho.
Canal de Isabel II controla desde esta instalación de Majadahonda el abastecimiento a más de seis millones de personas a través de los 13 embalses junto a 33 grandes depósitos reguladores; cerca de 20.000 kilómetros de red de aducción y distribución; 200 estaciones de bombeo de agua potable y residuales; más de 13.000 kilómetros de alcantarillado; 63 tanques de tormenta; 785 kilómetros de colectores y emisarios; o 156 estaciones depuradoras de aguas residuales.
Este complejo es de vital importancia al albergar una de las mayores potabilizadoras de la región. Además, acoge el Centro de Control de la compañía, una planta a la que llegan en tiempo real más de 200.000 datos sobre el ciclo hídrico y otros servicios complementarios como el laboratorio de aguas depuradas, el laboratorio de metrología y el almacén principal.",madrid
Detenido en Vallecas un hombre ruso por insultar y amenazar a su esposa ucraniana durante una discusión por la guerra,16:41h,05.04.2022,EP,"Agentes de la Unidad Integral de Distrito de Puente de Vallecas de la Policía Municipal de Madrid han detenido a un varón por un delito de violencia de género tras insultar y amenaza a su pareja en un piso de Puente de Vallecas, ha informado a Europa Press una portavoz del Cuerpo Local.
Los hechos tuvieron lugar el pasado día 26 de marzo a las 21 horas. Los policías recibieron un aviso de una mujer que estaba siendo agredida verbalmente por su pareja y se sentía amenazada. Todo había comenzado por una discusión sobre la invasión rusa de Ucrania. Él es nacionalidad rusa y ella ucraniana.
A su llegada, los agentes encontraron a la víctima descalza, nerviosa y pidiendo ayuda. Su pareja resultó detenida por un delito de violencia de género y conducida a comisaría. Finalmente, la mujer no ha presentado denuncia ni cargos contra él.",madrid
"Ayuso instalará los cuatro clústeres digitales en los puntos cardinales de Madrid: Las Rozas, Torrejón de Ardoz, Leganés y Tres Cantos",14:48h,05.04.2022,"
Christian Morata
 ","La presidenta de la Comunidad de Madrid, Isabel Díaz Ayuso, ha anunciado este martes que su Gobierno ha elegido los municipios de Las Rozas (Internet de las cosas), Tres Cantos (Blockchain), Leganés (Inteligencia Artificial) y Torrejón de Ardoz (Transformación Digital) como sedes para la ubicación definitiva de sus cuatro clústeres tecnológicos. Estarán ""arraigados en los cuatro puntos cardinales"" y con distintas áreas estratégicas para ""conectar a empresas, generar negocio mutuo e intercambiar conocimiento"", ha señalado.
Así lo ha señalado Ayuso durante la inauguración del Centro Global de Excelencia en Inteligencia Artificial y Datos de Hewlett Packard Enterprise, en Las Rozas, desde donde se atenderán las necesidades propias de la industria 4.0, tanto a nivel nacional como internacional. ""Un centro como este satisface una demanda global creciente"", ha sostenido.
""Vivimos un momento único, un momento excepcional en el crecimiento económico, tecnológico y digital de la Comunidad, que cada vez que se convierte en un mayor imán para empresas, inversores y talento internacional. Madrid está más de moda que nunca, así que qué mejor que hacer historia juntos"", ha añadido.
Sobre la Inteligencia Artificial, Ayuso ha destacado que es ""clave en el desarrollo económico"" y permite tanto a empresas como ciudadanos y administraciones ""ser más eficaces"" a la hora de tomar decisiones. Precisamente, también, por su papel transformador, la región contará con un clúster dedicado a esta área que tendrá su sede en Leganés, como ha explicado la mandataria.
De igual manera, para seguir impulsando la tecnología Blockchain, con la que se crea un entorno de confianza para el intercambio de datos, más transparente, dinámico y sencillo, se va a crear un espacio específico para ello en Tres Cantos. A este se unirá, también, el de Transformación Digital, situado en Torrejón de Ardoz y, por último, el de Internet de las Cosas en Las Rozas.
Esta apuesta por la transformación digital de la Comunidad de Madrid supone una inversión por parte del Ejecutivo regional de 1.650.000 euros.
Además, este último municipio forma parte del proyecto pionero, Madrid Oeste Tecnológico (MOT), que han puesto en marcha los ayuntamientos de Boadilla del Monte, Majadahonda y Pozuelo de Alarcón, para posicionar la zona en la vanguardia y liderar el crecimiento sostenible e inteligente de las ciudades.
""Tenemos un ecosistema propicio para ser nodo digital del sur de Europa y desde la Comunidad de Madrid trabajamos para atraer nuevos proyectos empresariales a la región y para seguir potenciando la transformación digital de todo el tejido empresarial"", ha indicado Ayuso, quien ha precisado que solo en centro de datos la región va a recibir en los próximos años inversiones por 680 millones de euros.",madrid
"Regular los VTC, instalar placas solares, tarjeta sanitaria virtual... las iniciativas de Madrid para ahorrar tiempo a los ciudadanos",13:51h,05.04.2022,"
Christian Morata
 ","La Comunidad de Madrid ha aplicado en el primer año de funcionamiento de la Línea Abierta contra la Hiperregulación más de un centenar de reformas -concretamente 111- destinadas a ""simplificar trámites y reducir trabas"" para ahorrar tiempo y dinero a los ciudadanos, como adecuar la normativa de los vehículos de transporte con conductor (VTC), la sustitución del permiso para instalar placas fotovoltaicas en tejados o jardines por una declaración responsables o la implantación de la tarjeta sanitaria virtual, entre otros.
Así lo ha señalado el consejero de Economía, Hacienda y Empleo, Javier Fernández-Lasquetty, en el balance del primer aniversario de la puesta en marcha de esta normativa que ha presentado en la Torre del Instituto de Empresa, durante un encuentro enmarcado en el décimo aniversario del South Summit. ""Se ha convertido en un canal de comunicación directo a través del cual emprendedores y empresas pueden informar a la Administración de los obstáculos que les impiden o dificultan desarrollar su idea o negocio"", ha sostenido.
Lasquetty ha subrayado que ""la participación de los afectados describiendo las barreras que encuentran en la normativa es fundamental para su supresión, así como para recoger propuestas de mejora directamente de aquellos más interesados"". Toda esta información ""se ha estudiado para determinar su viabilidad, trabajando en coordinación con las distintas consejerías del Ejecutivo regional, para proceder a la modificación o supresión de regulaciones que no responden a la realidad actual"", ha añadido.
Las actuaciones emprendidas por el Gobierno regional en esta materia ""buscan eliminar obstáculos regulatorios para generar mayor libertad económica, ámbito en el que también se encuentra la Ley de Mercado Abierto o las medidas para que puedan convivir el sector del taxi con las VTC"". Por ejemplo, los trámites para adecuar la normativa de los VTC para que puedan seguir prestando su servicio de transporte urbano en octubre, cuando ya habrá decaído el conocido como 'Decreto Ábalos'.
Destaca también la agilización de la instalación de paneles fotovoltaicos, reemplazando la autorización administrativa por la declaración responsable, el mismo procedimiento que se realiza para dinamizar otros trámites en materia de vivienda, como las obras de edificación de nueva planta o los cerramientos de parcelas o solares. Asimismo, se eliminan trabas a la hostelería y restauración, mediante la flexibilización de horarios y requisitos a cumplir.
Para la reducción de las trabas burocráticas se hace uso de la innovación tecnológica al servicio del ciudadano en el ámbito sanitario, con la implantación de la tarjeta sanitaria virtual, la videoconsulta y la telemedicina. Algo parecido sucede en la educación, con la Secretaría Virtual Educativa, que permite la matriculación digital y presentación telemática de todos los trámites.
Se agiliza también la instalación de infraestructuras de telecomunicaciones, eliminando la necesidad del procedimiento de evaluación ambiental para aquellas que operen con radiofrecuencias y haciendo que sea suficiente la declaración responsable urbanística para infraestructuras de red o estaciones radioeléctricas en edificaciones privadas en suelo urbano.
Del total de las medidas puestas en marcha, el 46% ya están aprobadas y el resto se encuentra en fase de tramitación. Por áreas de actuación, casi un tercio del total (32%) se encuadra en Medio Ambiente y Vivienda, seguidas de Sanidad (19%) y Transportes e Infraestructuras (12%).",madrid
Detenido el presunto autor de la muerte de un joven cuyo cadáver fue escondido en un sofá de una casa prefabricada en Alcorcón,11:09h,05.04.2022,EFE,"Agentes de la Policía Nacional detuvieron este lunes a primera hora de la mañana a un hombre de origen sudamericano y de 28 años como presunto responsable de la muerte de otro, cuyo cuerpo sin vida fue localizado en el interior de una casa prefabricada en el municipio madrileño de Alcorcón, el pasado día 24 de marzo, ha informado este martes la Jefatura Superior de la Policía de Madrid en un comunicado.
El informe preliminar de la autopsia determinó que, si bien el cadáver presentaba heridas por arma blanca en las piernas, la causa de la muerte fue un traumatismo craneoencefálico. El detenido ha sido puesto a disposición de la autoridad judicial, quien ha decretado su ingreso en prisión provisional como presunto responsable de un delito de homicidio.
El cuerpo del asesinado, brasileño de 27 años, fue hallado por una persona el día 24 de marzo a las 13:20 horas en las casas prefabricadas de una de venta y alquiler en la carretera de San Martín de Valdeiglesias, cerca del centro comercial Tres Aguas.
Hasta el lugar acudieron los agentes, que comprobaron que el joven estaba fallecido, rodeado de un gran charco de sangre, y no llevaba ningún tipo de documentación. Estaba amordazado de pies y manos y encajado en el hueco de un sofá. Llamaron directamente al juez de guardia, y no a los servicios de emergencias, pues el cuerpo presentaba ya el rigor mortis.
A continuación agentes del Grupo VI de Homicidios y del grupo de Delitos Violentos de la Brigada de Policía Científica se trasladaron al lugar de los hechos, donde estuvieron recabando pruebas y vestigios que pudieran esclarecer el crimen. También estuvieron examinando varios negocios de la zona, puesto que estos cuentan con cámaras de videovigilancia que pueden dar pistas sobre lo sucedido.
El cadáver fue trasladado por la noche al Instituto de Medicina Legal de Valdebebas, donde al día siguiente se le realizó la autopsia, que determinó que había muerto horas antes por el golpe en la cabeza, aunque tenía una veintena de cortes por todo el cuerpo.
Pese a la poca información aportada, ya se sabe que el difunto se llama A.D.S., un joven sin trabajo que vivía en esas casetas prefabricadas que había tenido altercado con varias personas. El arrestado tiene antecedentes por tentativa de homicidio, delitos a la autoridad y robo con fuerza. Era conocido de la víctima, al que le había acusado al presunto autor de robarle efectos personales.",madrid
"Los grafitis se extienden aún más por Plaza de España: ""Exigimos que el Ayuntamiento actúe ya y los limpie""",06:24h,05.04.2022,"
Belén Sarriá
 ","Las pintadas en Plaza de España siguen campando a sus anchas. Incluso, se han extendido a nuevas zonas, como los nuevos miradores para ver los restos arqueológicos que forman parte de la nueva ruta cultural. También han 'redecorando' aquellas que ya estaban vandalizadas, como por ejemplo, los nuevos bloques de granito que se ubican frente al Senado.
Una situación que ha vuelto a denunciar la portavoz socialista Mar Espinar, que quien ya cargó entonces, el pasado 18 de marzo, contra la gestión del equipo de Almeida. ""Este Ayuntamiento sigue sin multar. ¿De qué sirven nuevas ordenanzas si no son capaces de hacer cumplir las que ya existen?"", dijo en relación con la modificación de la norma que prepara el Ayuntamiento para endurecer las sanciones.
Un mes después, Mar Espinar exige al alcalde José Luis Martínez-Almeida que actúe ya y limpie la Plaza España porque ""una plaza tan emblemática [entre el Palacio Real, Gran Vía y el Templo de Debod] no puede estar llena de grafitis y sin que el Ayuntamiento no haga nada"".
Imágenes como estas acreditan que ""Madrid está sucia"" y que da ""una mala imagen"". Espinar insiste en que ""necesitamos una ciudad más limpia, más habitable, una ciudad para los madrileños"", advierte la socialista, al tiempo que insta a Almeida a ""ejercer sus competencias"" y ""recordar para lo que fue elegido y por lo que se le juzgará en 2023"", cuando se celebren las próximas elecciones.
El Ayuntamiento, por su parte, prometió limpiar los grafitis el pasado 13 de marzo, ""al igual que cualquier otra pintada de la ciudad"". También anunció ""castigos contundentes"" a través de una nueva ordenanza de limpieza. La portavoz municipal, Inmaculada Sanz, explicó a los medios que se va a hacer un ""incremento importante"" en lo que tiene que ver con las sanciones relativas a esos graves incumplimientos por parte de algunos ""que no hacen otra cosa sino ensuciar el patrimonio de todos"". En definitiva, quieren ""ser más contundentes en castigar esas conductas que son intolerables y seguir persiguiéndolos desde el punto de vista policial porque son ilegales"", señaló en rueda de prensa.",madrid
