Título,Hora,Fecha,Autor,Texto Completo,Categoría
"Jasikevicius recuerda cuando Lituania salió de la URSS: ""Hice colas con mis padres para tener algo de pan y papel higiénico""",08:02h,07.04.2022,"
SportYou
 EFE","El entrenador del Barça, el lituano Sarunas Jasikevicius, recordó este miércoles las dificultades que vivió en ""los primeros años"" posteriores a la independencia de su país, cuando él y sus padres formaron parte de ""las colas para tener algo de pan, arroz y papel higiénico"".
""Al principio fue muy duro, porque cuando pasas a ser un país independiente, ellos [la URSS] te cortan el acceso a todo lo que hasta entonces era muy fácil: la comida, la bebida, el gas..."", explicó el preparador báltico en una entrevista al programa El Matí de Catalunya Radio de la radio pública catalana.
Jasikevicius, que estaba a punto de cumplir 14 años cuando en 1990 Lituania recuperó el estatus de país independiente, contó que en aquellos ""primeros años"" formó parte junto a sus padres de ""las colas para tener algo de pan, arroz y papel higiénico"", puesto que el acceso a estos productos básicos ""era bastante limitado para todo el mundo"".
""Después he tenido la suerte de vivir ocho o nueve años en mi país y la verdad es que estamos encantados de cómo está progresando. Tenemos mucha suerte de ser independientes, tener una democracia y elegir un poco nuestro destino"", afirmó el lituano.
Jasikevicius, una de las figuras del mundo del deporte en España que se ha expresado de forma más contundente sobre la guerra en Ucrania, reconoció que ""en algunos días"" se siente ""mal"" por no seguir el conflicto con la misma atención que al inicio.
""En las primeras semanas estábamos todos pegados a la tele, pero ya llevamos 40 días de guerra. Estamos hablando menos y me siento mal. Estamos al lado de ucranianos, pensando en hacer cosas para ayudarles. Por lo menos hacer que se hable de ello"", añadió.
Jasikevicius también valoró que en los últimos 30 años Rusia ""se quedó bastante atrás"" en comparación con otras exrepúblicas soviéticas como Lituania, que en este tiempo ""ha dado un paso de gigante en el nivel de vida y progresado como país"".
""Quizás la gente de Rusia le apoya [a Vladimir Putin], porque no sabe lo que han crecido nuestros países. Por desgracia ahí no han tenido tanta suerte, pero eso es problema suyo"", comentó el entrenador del Barça.
Preguntado por los deportistas ucranianos que han regresado a su país para combatir la invasión rusa, Jasikevicius dijo que ""es algo muy difícil de pensar"" ya que se trata de personas que ""hace un mes y medio entrenaban cada día"".
""Te cambia la vida. Puedes hablar mucho, pero hasta que no te llega a ti no entiendes ni un 10%. Las fotos no sirven para entender lo que está sufriendo la gente"", reflexionó el preparador báltico.
El técnico del Barça, quien reconoció la preocupación por la cercanía de su país a la guerra, habló de qué haría él si Lituania fuera atacada: ""En esta situación habría que tomar decisiones. Por suerte parece que no estamos en esto ahora mismo. Estamos muy contentos de formar parte de la OTAN"".
""Algunos países piensan: 'Mientras no es mi guerra, no estoy muy preocupado'. Por desgracia, esto forma parte de la naturaleza humana. Aquí pensáis que todo está bastante lejos, pero en el mundo moderno todo está mucho más cerca"", comentó el entrenador del Barça.
Preguntado por la reincorporación de los equipos rusos a la Euroliga, Jasikevicius afirmó que, aunque ""ahora mismo es muy difícil hablar de esto"", anteriormente no había existido ""ningún problema"" en la competición con estos equipos y ""esto lo cambió la guerra"".
""Mientras haya guerra es imposible plantear su readmisión, pero cuando termine hay que ver"", añadió.
Por último, el técnico lituano hizo referencia a la situación política en Cataluña: ""Siempre es importante vivir en democracia. De alguna manera u otra, la gente catalana tiene que decidir"".",deportes
Paula Badosa arranca con buen pie en el torneo de Charleston,05:18h,07.04.2022,EFE,"Paula Badosa, número 3 del ránking mundial, debutó este miércoles con un sólido triunfo por 6-1 y 6-4 ante la húngara Anna Bondar (número 73) en el torneo WTA 500 de Charleston (Carolina del Norte, EE UU).
Tras despedirse de Miami en los cuartos de final, al retirarse por problemas físicos en el encuentro contra la estadounidense Jessica Pegula, Badosa regresó a la competición con buen ritmo y blindó su billete para la tercera ronda en una hora y cuarenta minutos.
La jugadora española, nacida en Manhattan en 1997, busca en la tierra batida de Carolina del Norte su segundo título del año, tras el de Sídney.
Su encuentro ante Bondar fue interrumpido durante cerca de media hora a causa de la lluvia, que ya había obligado a aplazar algunos partidos del programa del martes.
Pero Badosa no perdió concentración y, tras llevarse con facilidad el primer parcial sin conceder bolas de rotura, sentenció el partido con un 6-4 en el segundo.
Estuvo una rotura arriba con el 3-2, pero Bondar se la devolvió antes de entregar de nuevo su servicio en el 4-4 y acabar sucumbiendo.
En la próxima ronda, Badosa se verá las caras con la estadounidense Claire Liu (número 89).
Entre los demás resultados de la jornada, la checa Karolina Pliskova (número 7) se clasificó para la siguiente ronda con un trabajado triunfo por 5-7, 7-5 y 6-4 contra la ucraniana Katarina Zavatska (número 215).
El encuentro empezó este martes, pero fue interrumpido por la lluvia y reanudado este miércoles con Zavatska por delante 7-5 y 3-2, antes de la remontada de Pliskova.
También avanzó la bielorrusa Aryna Sabalenka, número 5 del mundo, que venció 7-6(3 y 6-4) a la estadounidense Alison Riske.
Se estrenó con un contundente triunfo la estadounidense Jessica Pegula, semifinalista en Miami, quien arrolló 6-1 y 6-2 a la italiana Jasmine Paolini en 46 minutos.",deportes
"Hasbulla se burla de Cristiano Ronaldo: ""Soy más famoso que él; solo sabe pasar el balón""",19:03h,06.04.2022,"
SportYou
 ","Quien tenga redes sociales se habrá encontrado eventualmente con vídeos o fotos de Hasbulla Hushetskiy, un joven de 18 años que ha hecho de la acondroplasia una forma de hacerse famoso. Este adolescente se ha hecho uno de los reyes de instagram y tiktok, y tan pronto está conduciendo superdeportivos, como subiéndose a un ring a luchar con el mismísimo Khabib Nurmagomedov, del que presume de ser buen amigo.
Lo que pocos esperaban es la controversia que ha levantado este influencer con una de la persona más seguida del mundo en instagram: Cristiano Ronaldo. El ruso no se ha tomado nada bien que el futbolista haya posado recientemente con uno de sus 'rivales', el influencer también acondroplásico Abdu Rozik, por lo que le le ha atacado.
Lo ha hecho en una entrevista con el exjugador de la NFL Caleb Pressley. El deportista le cuestionó sobre su relación con estrellas mundiales del deporte, como el citado Khabib o Erling Haaland, con quien también ha posado en redes recientemente. A la hora de hablar de 'CR7', le menospreció.
""No me puede importar menos Cristiano Ronaldo. Soy más famoso que él"", aseguró, aunque realmente no es así: a Hasbulla 'solo' le siguen dos millones de personas en instagram. Este inesperado ataque del joven ruso a la estrella portuguesa ha venido acompañada de una crítica deportiva, ya que Hasbulla asegura que Cristiano ""solo sabe pasar el balón"". Una afirmación que para un futbolista que ha superado los 800 goles en su carrera deportiva es, cuando menos, bastante inexacta.",deportes
"Sale a subasta la camiseta que llevó Maradona en México'86 contra Inglaterra, el partido de 'la mano de Dios'",18:08h,06.04.2022,"
SportYou
 ","La camiseta de la selección argentina que lució Diego Armando Maradona en el partido ante Inglaterra, en los cuartos de final de la Copa del Mundo de México 1986, donde anotó los dos de los goles del triunfo (2-1), está en subasta por la casa de pujas Sotheby's, y se estima que puede llegar a alcanzar un valor cercano a los 6 millones de libras (unos 7,2 millones de euros).
Ese día, en el estadio Azteca de la Ciudad de México, aún con el recuerdo vivo de la Guerra de las Malvinas que enfrentó en 1982 al Reino Unido y Argentina, Maradona protagonizó dos de los goles más históricos y recordados del fútbol mundial: el primero, denominado 'la Mano de Dios'; el segundo, 'el Gol del Siglo'.
Corría el minuto 51, cuando Maradona, en fuera de juego, aprovechó dentro del área un mal despeje alto de Steve Hodge, lo que hacía legal la posición del 'Pelusa', para anticiparse en el salto al meta Peter Shilton y anotar teóricamente de cabeza el 1-0. En realidad, su remate fue con el puño izquierdo, pero ello no fue advertido ni por el colegiado principal ni por sus asistentes. Se le denominó posteriormente como 'la Mano de Dios'.
El 2-0, en el minuto 55, fue una obra de arte. Agarró Maradona el balón en medio campo y se fue en velocidad hacía el área inglesa deshaciéndose de cuantos rivales le salían al paso, regateando incluso al propio Shliton. Fue años después, en votación popular de la FIFA, elegido el mejor tanto de la historia de los mundiales.
Sin duda, la camiseta de Maradona era un preciado objetivo. Y la logró, curiosamente, quien le dio la 'indeseada' asistencia del 1-0: Steve Hodge, centrocampista en ese partido y que al término del mismo se la intercambió.
""Después de una entrevista, bajé, detrás de la portería, a los vestuarios… Mientras bajaba, Maradona caminaba con dos de sus compañeros. Lo miré a los ojos, tiré de mi camisa como si dijera '¿hay alguna posibilidad de intercambio?', y él se acercó, hizo un gesto de oración e intercambiamos camisas. Y eso fue todo. Fue tan simple como eso”, contó Hodge hace años en una entrevista televisiva cómo consiguió la preciada camiseta con el '10'.
Incluso, el propio Maradona en un pasaje del libro 'Tocado por Dios', que recoge los momentos más brillantes de su carrera como futbolista, relata este intercambio. ""Camino al vestuario, uno de los chicos ingleses (resultó ser Hodge, pero no estaba seguro en ese momento) me pidió que lo hiciera. intercambiar camisetas con él. Dije que sí y lo hicimos"", se apunta.
El preciado trofeo, propiedad de un Hodge que hasta ahora siempre se negaba a venderla, ha estado los últimos años exhibiéndose en el museo del Manchester United. Pero ahora su propietario ha decidido meterla a subasta.
La subasta, a cargo de Sotheby's, es por internet, terminará el próximo 4 de mayo. La propia casa de apuestas fue la que autentificó la camiseta como la que utilizó Maradona justo en la segunda mitad del partido (intercambió en el descanso la del primer tiempo).
Ya abierta la puja, se estima que puede alcanzar un valor entre los 4 y 6 millones de libras (entre los 4,8 y los 7,2 millones de euros).",deportes
Koke se pica con Guardiola por la enésima crítica del entrenador del City al estilo ultradefensivo del Atlético,17:40h,06.04.2022,"
SportYou
 ","El Manchester City salió con una nimia ventaja del partido de ida de cuartos de final de la Champions League frente a un Atlético que resistió el asedio 'skyblue'. La posesión del balón fue claramente para el conjunto inglés (68%), si bien no acertaron a poner en peligro la meta de Oblak más que una vez en condiciones.
La dificultad para encontrar portería se debió, según Guardiola, al estilo ultradefensivo de Simeone. El planteamiento quedó claro desde el minuto uno: cinco defensas atrás, más Kondogbia de cierre en el centro del campo. Cualquier cosa que fuera mínimamente creativa quedaba totalmente neutralizada por la defensa rojiblanca.
""Son unos maestros defendiendo todos juntos atrás. En la prehistoria, hoy y en 100.000 años atacar dos líneas de cinco es muy difícil. Es cuestión de tener paciencia"", dijo Guardiola en la rueda de prensa. Aunque es una obviedad, no a todos les ha sentado bien ese intento de menosprecio (o así se ha leído).
Es el caso de Koke. El centrocampista y capitán del Atlético ha replicado a Guardiola con una indirecta muy obvia a través de instagram en una story: ""Enamorado de tu historia desde la prehistoria. Orgulloso de ser del Atleti"". Acompañado a este texto, el escudo clásico del club colchonero.
El Atlético de Madrid perdió 1-0 en el Etihad Stadium, por lo que tendrá que remontar en el Wanda Metropolitano si quiere estar en semifinales de la Champions League.",deportes
"Boris Johnson, sobre deportistas transgénero: ""No creo que los hombres biológicos deban competir en eventos femeninos""",17:04h,06.04.2022,"
SportYou
 ","El primer ministro del Reino Unido, Boris Johnson, dijo este miércoles que las mujeres transgénero no deberían poder competir en el deporte femenino.
""No creo que hombres biológicos debieran competir en eventos femeninos. Quizás sea una opinión controvertida, pero es lo sensato para mí"", dijo Johnson a los medios en una visita a un hospital.
""También creo que las mujeres deberían tener espacios, ya sea en hospitales, cárceles o en vestuarios, dedicadas únicamente a mujeres. Si esto me pone en conflicto con alguien, tendremos que trabajar en ello. Esto no quiere decir que no apoye a la gente que quiera cambiar su género. Es vital que demos a esta gente el máximo amor y apoyo"", añadió el primer ministro.
Estas declaraciones llegan después de que la ciclista transgénero Emily Bridges recibiera la negativa a participar en los campeonatos nacionales británicos este fin de semana, donde hubiera podido competir, entre otras estrellas, con la cinco veces campeona olímpica Laura Kenny.
La federación británica de ciclismo informó de que la UCI suspendió su participación porque estos campeonatos reparten puntos para el ránking internacional y que, para poder disputar la prueba, necesita el permiso para participar también en competiciones internacionales, algo que se encuentra en proceso.",deportes
Ronald Koeman volverá a los banquillos después del Mundial de Catar 2022 como seleccionador de Países Bajos,14:54h,06.04.2022,"
SportYou
 EP","El extécnico del FC Barcelona Ronald Koeman volverá a coger las riendas de la selección de su país tras la disputa del Mundial de Catar 2022 de finales de este año, cuando ocupará el puesto que deje Louis van Gaal a partir del 1 de enero de 2023.
Koeman, que estaba libre desde que fue destituido del conjunto catalán, ha firmado un contrato por los próximos cuatro años, hasta la Copa del Mundo del 2026 que se celebrará en México, Estados Unidos y Canadá, en lo que será su segunda etapa al frente de los Países Bajos, combinado al que dirigió entre febrero de 2018 y agosto de 2020, y que dejó para dirigir al Barça.
""Estoy deseando que llegue esta nueva colaboración. Hace poco más de un año y medio no dejé realmente la selección holandesa por estar descontento. Mi etapa fue buena, los resultados fueron buenos y mi relación con los internacionales también fue buena, y pronto seguiremos por ese camino"", apuntó Koeman en la web de la Federación de Fútbol de Países Bajos (KNVB).
Por su parte, Marianne van Leeuwen, directora federativa de Fútbol Profesional, recalcó que están ""muy felices"" por este retorno del exjugador, que había dejado ""una gran satisfacción por su trabajo y resultados"" en su anterior etapa y con el que contactaron ""a mediados de enero"" ya que el relevo se producirá ""en un momento atípico"" al ser ya final de año natural y la mayoría de los ""mejores entrenadores están con contrato"".",deportes
La jugadora ucraniana de bádminton Kristina Sotomayor recorrió 3.000 kilómetros desde Leópolis hasta Oviedo para dar a luz en España,13:59h,06.04.2022,"
SportYou
 EFE","La ucraniana del CB Oviedo Kristina Sotomayor, que huyó de su país para dar a luz en España, destacó el apoyo recibido por parte de la embajada española para salir de Ucrania y la ""gran ayuda"" que ha sentido a su llegada ""para poder empezar aquí la vida de nuevo"".
""Dado que mi marido es español, tuvimos apoyo por parte de la embajada española y sentimos una gran ayuda en general del país. Especialmente cuando nos organizaron una recogida de dinero para poder empezar aquí la vida de nuevo, en la cual participó muchísima gente. No puedo explicar cómo de agradecida estoy con todas las personas que aportaron su granito de arena. Yo no esperaba tanto cariño, y fue increíble todo lo que hicieron"", dijo.
Con motivo del Día Internacional del Deporte para el Desarrollo y la Paz, Kristina Sotomayor-Dzhanhobekova relató su experiencia en una entrevista con la Federación Española de Bádminton (FESBA), después de recorrer más de 3.000 kilómetros desde Leópolis hasta Oviedo en coche, poco antes del nacimiento de su hijo Samuel.
""Me acuerdo que ese día, el 24 de febrero. Estábamos durmiendo y me desperté sobre las 7, miré el móvil y en un grupo que tengo con compañeros de Ucrania vi un mensaje de una mujer que decía algo así como: 'No os preocupéis, todo va a estar bien, estar tranquilos'. No entendía a qué se estaba refiriendo, ni sabía lo que había pasado. Ya entonces me enteré de que estaban bombardeando zonas de la fronteras con Rusia y se oían ruidos de sirenas por todas partes"", explicó.
La considerada 'jugadora más valiosa' de la Copa Iberdrola 2020 y ganadora del título del TOP10 de la División de Honor 2020-2021, reconoció que nunca pensó que iba a escuchar las sirenas previas a los bombardeos y que en aquel momento ella y su marido estaban pensando si volver o no a España y decidieron regresar.
""Me llega información y la verdad es que se sufre mucho... Como mejor creo que se puede ayudar a la gente de allí es tratando de sacar a los niños, proporcionarles una vivienda temporal, o bien promoviendo actividades en instalaciones de algún Club o CTD por lo menos hasta final de la etapa que están viviendo. Ayudar además a que estos niños puedan practicar deporte estando a salvo, y que los padres estén más tranquilos en la medida de lo posible"", comentó.
Mientras se adapta a su nueva vida, 'Kristy', que es como la conocen sus compañeros de club, también consideró que las donaciones a organizaciones que recaudan fondos para comprar y enviar ropa y comida son otra forma muy importante de ayudar a Ucrania, junto al traslado de las personas que están en la frontera de Polonia o Hungría para tratar de salir del país.
""Una compañera mía llamada Olena Bezshchasna, que es voluntaria en el Batallón de Defensa Territorial del municipio Obujiv, región de Kiev, me comentó que entre sus necesidades está la adquisición de un vehículo para ayudar al traslado de personas que quieren desplazarse allí, así como la gestión de alojamiento para los refugiados de las zonas más peligrosas"", añadió.",deportes
Ancelotti da negativo y llegará a tiempo para dirigir al Real Madrid ante el Chelsea,13:47h,06.04.2022,"
SportYou
 EFE","Carlo Ancelotti, técnico italiano del Real Madrid, dio negativo en el último test PCR que le realizó el club, podrá volver a dirigir a su equipo en el partido de ida de los cuartos de final de la Champions League, para lo que volará en la mañana del miércoles a Londres para sumarse al hotel de concentración.
""El Real Madrid comunica que nuestro entrenador Carlo Ancelotti ha dado resultado negativo en COVID-19, por lo que viajará a Londres esta mañana para incorporarse a la concentración del primer equipo"", aseguró el club en un comunicado.
Ancelotti, contagiado por coronavirus desde el pasado miércoles, no pudo dirigir al Real Madrid en el regreso de LaLiga el sábado en Balaídos y ha ido dando positivo en cada test diario al que se ha sometido. Su hijo Davide, segundo técnico, tomó el mando junto a la ayuda del resto de integrantes del cuerpo técnico durante su ausencia.
Tras dar negativo, 'Carletto' voló en la mañana del miércoles a Londres, donde se reencontrará con sus jugadores y el cuerpo técnico en el hotel de concentración. Podrá dar la charla previa al partido y el equipo titular antes de partir hacia Stamford Bridge, donde reaparecerá en el banquillo.",deportes
"Escabrosos detalles sobre las 22 demandas por acoso sexual al NFL Deshaun Watson: ""Nos tocaba con su pene y nos pedía sexo oral""",13:41h,06.04.2022,"
SportYou
 ","Deshaun Watson está en serios problemas. El flamante fichaje de los Cleveland Browns se encuentra en pleno juicio por las 22 demandas de acoso sexual que pesan sobre él y sobre las que ahora se conocen más datos, bastante repulsivos.
Las denuncias están relacionadas con varias sesiones de masaje llevadas a cabo entre 2020 y 2021, en las que acusan al jugador de la NFL de tener una ""conducta sexual inapropiada"" con las mujeres que trabajaron con él. ""Nos tocaba con su pene e intentaba obligarnos a practicarle sexo oral"", coinciden varias masajistas.
El proceso judicial se encuentra en un punto en el que Watson tendrá que aclarar si mantuvo relaciones sexuales con alguna de las 18 masajistas que curiosamente firmaron un documento apoyando la defensa del quarterback.
Además, la jueza del caso ha solicitado que se le presente una relación de todos los masajes recibidos por el jugador de 2019 en adelante, así como de las profesionales que los llevaron a cabo. Todo para aclarar una situación ante la que Watson se defiende constantemente. ""Sé que estas acusaciones son muy serias, pero nunca he agredido a ninguna mujer. Nunca le falté al respeto a ninguna mujer"", comentó en rueda de prensa.",deportes
Lewis Hamilton quiere su propio biopic después del 'éxito' de la bofetada de Will Smith en los Oscar,13:08h,06.04.2022,"
SportYou
 ","La película King Richard (El método Williams en España) está recientemente en boca de todo el mundo, por su calidad cinematográfica y por la bofetada de Will Smith a Chris Rock en la gala de los Oscar. La cinta que cuenta la historia del padre de las tenistas Serena y Venus Williams ha calado hondo en el siete veces campeón del mundo de Fórmula 1 Lewis Hamilton y el británico ha declarado que estaría encantado de tener su propio biopic.
Aunque Hamilton tiene su propio documental, producido por él mismo, ahora quiere ir más allá y se marca una película biográfica como objetivo. ""Tenemos este documental en el que estamos trabajado y creo que simplemente tienes que hacer todo en el momento oportuno"", dijo Hamilton.
""El documental es en lo que estoy centrado ahora mismo. Creo que las historias están ahí para perdurar en el tiempo. Es importante. Creo que se puede aprender mucho. Y como he dicho, si puedes tener un impacto positivo en la gente, aunque sea nada más que en una persona o familia, sería increíble"", amplió el piloto.
Eso no quita que en un futuro no contemple la idea de un biopic. ""Creo que sí, que quizás intente hacer lo mismo [que con King Richard]. Me siento inspirado por lo que hizo Will Smith junto a su equipo"", aseguró Hamilton.",deportes
