Título,Hora,Fecha,Autor,Texto Completo,Categoría
Los tesoros que buscan los coleccionistas y cualquiera podría tener en su casa,15:59h,06.04.2022,"
20minutos
 ","Las monedas y los billetes de pesetas ya hace más de 20 años que no están en circulación e, incluso, ya tampoco se pueden cambiar por euros. Por ello, quienes hayan pensado en tirar estas monedas o billetes, es mejor que esperen y comprueben primero si tienen algún valor.
Lógicamente, ya no tienen valor oficial, pero sí que pueden tenerlo en el mundo de la numismática, ya que los coleccionistas están dispuestos a pagar grandes cantidades de dinero por hacerse con cierto tipo de monedas y billetes, que corresponden con fechas específicas.
De hecho, en plataformas como eBay o Etsy se pueden encontrar anunciados algunos de los billetes y monedas con los que poder ganar miles de euros.
Un ejemplo es el pack de 236 billetes de 5000 pesetas emitidos el 23 de octubre de 1979 en Madrid, que tiene impreso el rostro del rey Juan Carlos I. Por este conjunto de billetes, en eBay se pagan hasta 13.000 euros.
Lo mismo sucede con los billetes de 5000 pesetas de 1992, una serie especial de unos billetes de los que apenas se conocen ejemplares. En ellos, aparecen los rostros de los Reyes Católicos, las famosas carabelas y el de Colón. Se llegan a vender en eBay por 3.500 euros.
Por 3.800 euros se venden dos billetes de 1.000 pesetas del mes de enero de 1940, concretamente, la serie A. El vendedor tan solo indica que tiene unas manchas en uno de los bordes debido a la propia tinta del billete.
Como estos, hay otros muchos billetes y monedas que tienen gran valor para los coleccionistas, por lo que todo aquel que tenga alguna pieza que pueda considerar antigua y, sobre todo, difícil de encontrar, puede comprobar su valor en aplicaciones móviles con tan solo una foto.",economia
Qué desgrava en la Declaración de la Renta 2021-2022 si vivo en Andalucía,12:57h,06.04.2022,"
20minutos
 ","Este miércoles 6 de abril arranca la campaña de la Renta y Patrimonio correspondiente al ejercicio económico de 2021, por lo que a partir de este día los contribuyentes que tengan que presentar la declaración podrán confeccionar el borrador por Internet en el portal 'Renta 2021' habilitado por la Agencia Tributaria.
En este sentido, muchos contribuyentes se preguntan a qué deducciones tienen derecho para aplicarlas en la declaración anual del IRPF y ahorrar en impuestos, tanto estatales como autonómicas.
En el caso de Andalucía, los contribuyentes que en el año 2021 hayan tenido su residencia habitual en esta región podrán aplicar diversas deducciones autonómicas, recogidas en el 'Manual de la Renta 2021' de la Agencia Tributaria.
Se contempla una deducción de 30 euros por las subvenciones o ayudas económicas percibidas en aplicación de la normativa de región para la adquisición o rehabilitación de la residencia habitual que tenga la consideración de protegida. Esta desgravación solo podrá aplicarse una vez.
Se establece una deducción del 15% de las cantidades satisfechas por el arrendamiento de la vivienda habitual del contribuyente, siendo el límite máximo de la deducción de 500 euros anuales. En este sentido, uno de los requisitos es no haber cumplido los 35 años de edad y, en el caso de que la tributación sea conjunta, al menos uno de los cónyuges debe cumplir esta condición.
La cuantía de esta deducción es de 50 euros por cada hijo nacido o adoptado, incluso podría aplicarse si el hijo no convive con el contribuyente en la fecha de devengo del impuesto. ""En el caso de partos o adopciones múltiples, la cuantía correspondiente de la deducción se incrementará en 50 euros por cada hijo"".
Se aplica 600 euros por cada hijo adoptado en el período impositivo en el que se haya inscrito la adopción en el Registro Civil, siempre que se trate de una adopción de carácter internacional.
Se trata de una deducción de 100 euros para contribuyentes que sean padres o madres de familia monoparental. También en el caso de hijos mayores de edad cuya incapacidad haya sido declarada a nivel judicial y que estén sujetos a patria potestad.
""La deducción anterior se incrementará adicionalmente en 100 euros por cada ascendiente que conviva con la familia monoparental, siempre que generen el derecho a la aplicación del mínimo por ascendientes mayores de 75 años establecido en la normativa estatal del IRPF"", destaca la Agencia Tributaria.
Los contribuyentes pueden acceder a una deducción de 100 euros por cada contribuyente que tenga la consideración legal de persona con discapacidad en grado igual o superior al 33%.
A nivel general, se aplica deducción de 100 euros por cada persona con discapacidad que otorgue derecho a la aplicación del mínimo por discapacidad de ascendientes o descendientes, conforme a la normativa estatal del IRPF.
El límite de la deducción no podrá ser superior a los 250 euros, y se aplicará el 15% del importe satisfecho por el empleador o empleadora a la Seguridad Social correspondiente a la cotización anual de un empleado o empleada del hogar familiar.
El límite máximo para aplicar la deducción por inversión en la adquisición de acciones y participaciones sociales como consecuencia de acuerdos de constitución de sociedades o ampliación de capital en las sociedades mercantiles es de 4.000 euros al año.
Se aplicará el 20% de las cantidades invertidas durante el ejercicio 2021 en la adquisición de acciones o participaciones sociales.
Los contribuyentes en Andalucía tienen derecho a la deducción por familia numerosa de categoría general, cuya cuantía es de 200 euros. En el caso de familias de categoría especial, la deducción será de 400 euros.",economia
Qué desgrava en la Declaración de la Renta 2021-2022 si vivo en Madrid,11:12h,06.04.2022,"
20minutos
 ","Este miércoles 6 de abril arranca la campaña de la Renta y Patrimonio correspondiente al ejercicio económico de 2021, por lo que a partir de este día los contribuyentes que tengan que presentar la declaración podrán confeccionar el borrador por Internet en el portal 'Renta 2021' habilitado por la Agencia Tributaria.
En este sentido, muchos contribuyentes se preguntan a qué deducciones tienen derecho para aplicarlas en la declaración anual del IRPF y ahorrar en impuestos, tanto estatales como autonómicas.
En el caso de la Comunidad de Madrid, los contribuyentes que en el año 2021 hayan tenido su residencia habitual en esta región podrán aplicar diversas deducciones autonómicas, recogidas en el 'Manual de la Renta 2021' de la Agencia Tributaria.
Uno de los beneficios fiscales es la deducción de 600 euros por cada hijo nacido o adoptado que se aplica, ""tanto en el período impositivo en el que se produzca el nacimiento o la adopción como en cada uno de los dos períodos impositivos siguientes"".
Según la normativa de la comunidad, la deducción por nacimiento o adopción de hijos ""del artículo 4 del Texto Refundido de las Disposiciones Legales de la Comunidad de Madrid en materia de tributos cedidos por el Estado, en la regulación vigente desde el 1 de enero de 2018, solo será aplicable a los hijos nacidos o adoptados a partir de dicha fecha"".
Se contempla también una cuantía de 600 euros por cada hijo adoptado en el período impositivo, ""siempre que se trate de una adopción de carácter internacional"". Asimismo, esta desgravación fiscal será compatible con la deducción por nacimiento o adopción.
Los contribuyentes podrán deducir por cada menor en régimen de acogimiento familiar las siguientes cantidades:
Se trata de una deducción de 1.500 euros por cada persona mayor de 65 años o con discapacidad igual o superior al 33%, cuando se cumplan los siguientes requisitos:
Los contribuyentes podrán deducirse hasta un máximo de 1.000 euros por el arrendamiento de la residencia habitual, tanto en tributación individual como conjunta. Por tanto, la desgravación es del 30% de las cantidades pagadas en concepto de alquiler.
Uno de los requisitos es que el contribuyente debe tener menos de 35 años de edad en la fecha de devengo del impuesto. ""No obstante, la deducción podrá aplicarse también si el contribuyente tiene más de 35 años y menos de 40 años, siempre que, durante el periodo impositivo, se haya encontrado en situación de desempleo y haya soportado cargas familiares"", aclara el organismo público.
Los contribuyentes se podrán deducir el 15% de las cantidades donadas a fundaciones que cumplan los requisitos de la Ley 1/1998, de 2 de marzo, de Fundaciones de la Comunidad de Madrid que persigan fines culturales, asistenciales, educativos o sanitarios o cualesquiera otros de naturaleza similar. También el 15% de las cantidades donadas a clubes deportivos elementales y básicos definidos.
Las personas que hayan residido en la comunidad en 2021 podrán aplicarse las siguientes deducciones en este ámbito:
Como detalla la Agencia Tributaria, la cantidad a deducir no podrá exceder de:
Se contempla una deducción del 20% de las cuotas ingresadas por el contribuyente por cotizaciones al Sistema Especial de Empleados de Hogar del Régimen General de la Seguridad Social, con un límite de 400 euros anuales.
También el 30% de las cuotas ingresadas por cotizaciones al Sistema Especial de Empleados de Hogar del Régimen General de la Seguridad Social, en el caso de contribuyentes que estén en situación de familia numerosa, con un límite de 500 euros anuales.
Se aplica una deducción del 10% del importe resultante de ""minorar la cuota íntegra autonómica en el resto de deducciones autonómicas aplicables en la Comunidad de Madrid y la parte de deducciones estatales que se apliquen sobre dicha cuota íntegra autonómica"".
La cuantía de la deducción será de 1.000 euros para los contribuyentes en los que se den las siguientes situaciones:
De esta manera, la desgravación se practicará en el período impositivo en que se produzca el alta en el censo y siempre que la actividad económica se desarrolle en la región. Además, el contribuyente debe mantenerse en este censo durante, al menos, 12 meses desde el alta.
El límite máximo de la desgravación será de 10.000 euros en la declaración. Así, será del 20% en las cantidades invertidas en el ejercicio en ""la adquisición de acciones correspondientes a procesos de ampliación de capital o de oferta pública de valores, en ambos casos a través del segmento de empresas en expansión del Mercado Alternativo Bursátil aprobado por Acuerdo del Consejo de Ministros del 30 de diciembre de 2005"".",economia
Todo sobre las hipotecas en la Renta 2021-2022: ¿cuáles desgravan? ¿Cuánto dinero?,09:56h,06.04.2022,"
20minutos
 ","Este miércoles 6 de abril comienza la campaña de la declaración de la Renta y Patrimonio correspondiente al ejercicio de 2021 y que se prolongará hasta el 30 de junio de 2022. A partir de este día, se podrá presentar el borrador de forma telemática y una de las dudas que surge entre una gran parte de los contribuyentes es si existe la posibilidad de desgravarse parte de la hipoteca de la vivienda habitual.
¿Quién puede aplicar esta deducción? ¿Cómo se realiza? Como detallan los especialistas del comparador financiero Helpmycash, si firmaste un préstamo hipotecario antes del mes de enero de 2013, podrás aplicar la deducción. Entonces, ¿qué requisitos se deben cumplir?
Las personas que formalizaron una hipoteca antes de la fecha citada anteriormente podrán aplicar esta desgravación en su declaración, aunque deben cumplir estos requisitos:
Los expertos de Helpmycash aseguran que si se cumplen ambos requisitos, el contribuyente podrá desgravarse ""hasta un 15% sobre un máximo anual amortizado de 9.040 euros"", que se obtiene al sumar los siguientes tramos:
Por tanto, ""podemos ahorrar hasta 1.356 euros en IRPF al año"". Si la hipoteca tiene dos titulares y ambos hacen su declaración individual por separado, ""la deducción se puede aplicar sobre un máximo de 18.080 euros"".
Estos son todos los gastos que pueden desgravar en la declaración anual del IRPF:",economia
Qué me puedo desgravar en la Renta 2021-2022 si tengo un piso alquilado,07:48h,06.04.2022,"
20minutos
 ","Este miércoles 6 de abril de 2022 arranca la campaña de la Renta y Patrimonio correspondiente al ejercicio económico de 2021 y, a partir de este día, los contribuyentes podrán comenzar a solicitar el borrador de la declaración para su presentación de forma telemática en la sede electrónica de la Agencia Tributaria.
Una de las cuestiones más importantes de cara a la confección del borrador de la Renta es sobre las deducciones que podrían aplicar en su declaración para saber qué conceptos pueden desgravarse, ya sean a nivel estatal o autonómicos.
En este sentido, una de las desgravaciones más frecuentes en el IRPF es la del alquiler de un inmueble a nivel estatal. Así, el arrendatario podrá deducirse este concepto en la declaración de la Renta, siempre y cuando el contrato se haya firmado antes del 1 de enero de 2015. Asimismo, debe encontrarse en vigor en el momento de presentar la declaración.
Como detalla la Agencia Tributaria, el contribuyente se podrá deducir ""el 10,05% de las cantidades satisfechas en el período impositivo por el alquiler de tu vivienda habitual, siempre que tu base imponible sea inferior a 24.107,20 euros anuales y, sin perjuicio de la deducción por alquiler de vivienda habitual que, en su caso, para cada ejercicio, haya aprobado tu Comunidad Autónoma"".
Por tanto, esta deducción es a nivel estatal y no afecta a las propias de cada comunidad autónoma, que establece sus porcentajes y cuantías mínimas y máximas.
¿Y el casero o arrendador se puede deducir algún concepto en la declaración? ¿Qué debe hacer? La persona que alquila la vivienda deberá incluir en la declaración las rentas obtenidas porque son consideradas como rendimientos del capital inmobiliario. Así, los arrendatarios podrán deducirse los intereses y otros gastos hipotecarios, así como aquellos relacionados con la reparación de la vivienda o el IBI en la próxima declaración.",economia
Declaración de la Renta 2021-2022: cómo solicitar cita previa telefónica,07:46h,06.04.2022,"
20minutos
 ","Este miércoles 6 de abril de 2022 comienza la campaña de la Renta y Patrimonio correspondiente al ejercicio económico de 2021 y lo hace cargada de novedades, como los cambios en los tramos impositivos del Impuesto sobre la Renta de las Personas Físicas (IRPF) o las modificaciones fiscales en los planes de pensiones.
A partir de este día, los contribuyentes que tengan que confeccionar la declaración y presentarla ante la Agencia Tributaria podrán hacerlo de manera telemática en el portal web habilitado: 'Renta 2021'. Pero, ¿cuándo se podrá tramitar mediante vía telefónica? ¿Será necesario pedir cita previa?
La gestión de la declaración por vía telefónica comenzará el próximo 5 de mayo de 2022, pero para poder tramitarla con uno de los agentes de la Agencia Tributaria será necesario solicitar cita previa.
Se podrá pedir cita para que la Agencia Tributaria confeccione tu declaración por teléfono correspondiente al ejercicio económico de 2021 desde el 3 de mayo y estará habilitado este servicio hasta el 29 de junio a través de las siguientes vías:",economia
"Nuevos tramos, alquileres, criptomonedas... estas son las principales novedades en la Declaración de la Renta 2021-2022",07:39h,06.04.2022,"
Elena Diaz
 ","Este miércoles 6 de abril arranca la campaña de la Renta y Patrimonio correspondiente al ejercicio económico de 2021, y lo hace cargada de novedades fiscales. A partir de hoy, los contribuyentes podrán confeccionar el borrador y presentar la declaración por Internet en el portal 'Renta 2021' o mediante la aplicación móvil de la Agencia Tributaria.
Como especifica el organismo público, el plazo para la presentación de las declaraciones se prolongará hasta el próximo jueves 30 de junio, aunque la fecha límite para la entrega de las declaraciones con resultados a ingresar y cuyo pago se efectúe con domiciliación bancaria será el lunes 27 de junio.
El 3 de mayo se abre el plazo para poder solicitar cita previa para la confección y presentación de la declaración por vía telefónica, que se podrá realizar desde el 5 de mayo con la ayuda de los agentes de la Agencia Tributaria.
Asimismo, el periodo para presentar la declaración presencialmente en las oficinas de la institución pública arrancará el próximo 1 de junio, pero para ello habrá que solicitar cita previamente en la Administración, cuyo servicio estará disponible desde el 26 de mayo hasta el 29 de junio. Las vías para poder solicitar cita previa, tanto para la gestión telefónica como presencial, son las siguientes:
Una de las principales novedades de cara a esta campaña es la modificación de la escala general de gravamen de la base liquidable del Impuesto sobre la Renta de las Personas Físicas (IRPF) introducida en los Presupuestos Generales del Estado (PGE) de 2021, por la que se incorporan nuevos tramos.
De esta manera, se introduce un nuevo tipo de gravamen para las rentas de trabajo superiores a 300.000 euros, por lo que pasan a ser seis en lugar de cinco los tramos en este impuesto.
En este sentido, la subida será de dos puntos porcentuales para las rentas superiores a dicha cantidad. Por tanto, los tramos del IRPF para las rentas del trabajo quedarían de la siguiente manera:
Por otra parte, en los Presupuestos Generales del Estado también se ha modificado la escala de gravamen de la base liquidable del ahorro. Como detallan desde el Sindicato de Técnicos del Ministerio de Hacienda (Gestha), se ha introducido, tanto en la escala estatal como autonómica, un nuevo tramo a partir de los 200.000 euros con un tipo de gravamen aplicable del 13%. Así, el tipo llega hasta el 26%.
Asimismo, se produce un incremento en el Impuesto sobre el Patrimonio del 1% para patrimonios superiores a 10 millones de euros, por lo que pasa del 2,5% a un tipo del 3,5%.
Otra de las novedades para la declaración del ejercicio económico de 2021 está relacionada con los planes de pensiones. El tratamiento fiscal siempre ha sido una de las ventajas de escoger los planes de pensiones privados, ""pues la normativa permite reducir de la base imponible del IRPF las aportaciones realizadas a sistemas de previsión social"", indican desde la Organización de Consumidores y Usuarios (OCU).
""Se reduce de 8.000 a 2.000 euros anuales el límite general de reducción aplicable en la base imponible por las aportaciones y contribuciones a sistemas de previsión social, si bien se prevé que el nuevo límite pueda incrementarse en 8.000 euros más para las contribuciones empresariales"", detallan en Gestha.
Este cambio se debe a la apuesta por ""incentivar las contribuciones empresariales en lugar de las individuales realizadas por el contribuyente"". Además, se reduce ""de 2.500 a 1.000 euros anuales el límite máximo aplicable por aportaciones a sistemas de previsión social de los que sea partícipe, mutualista o titular, el cónyuge del contribuyente"", añaden los técnicos de Hacienda.
Para los seguros privados de dependencia, ""la aportación con derecho a ventaja pasó de 8.000 a 2.000 euros, sumando las aportaciones de todas las personas que satisfagan primas a favor de un mismo contribuyente, incluidas las de este"", añaden desde la OCU.
La declaración de la Renta que se presentará este año incluirá una casilla especial destinada a la tributación de las criptomonedas. Uno de los objetivos del Ministerio de Hacienda es establecer un control más exhaustivo sobre las inversiones y transacciones con estas monedas digitales para hacer frente al fraude fiscal.
En este sentido, la Agencia Tributaria obliga a los contribuyentes a declarar las inversiones realizadas con criptomonedas cuando los ingresos obtenidos superen los 1.000 euros, tanto en España como en el extranjero. Así, este año se ha implementado la casilla 46 para rellenar la información relacionada con las monedas digitales, que recibe el nombre de 'Saldos en monedas virtuales'.
Este año están exentas las rentas obtenidas por las ayudas económicas excepcionales causadas por la borrasca Filomena, que tuvo lugar en enero de 2021, y aquellas otorgadas por los daños ocasionados por la erupción del volcán en la isla de La Palma.
""Como consecuencia de la erupción del volcán de Cumbre Vieja en la isla de La Palma, también se modifica la Ley del IRPF, con efectos desde el 1 de enero de 2021, para incluir entre las causas de las exenciones de las ayudas públicas para reparar la destrucción de elementos patrimoniales causados por incendio, inundación, hundimiento, erupción volcánica u otras causas naturales"", explican los especialistas de Gestha.
Otra novedad es que se introducen nuevas deducciones en la Renta de este año por la rehabilitación energética en edificios. En este sentido, ""las obras tienen que haber sido realizadas a partir del 6 de octubre de 2021"", explican los portavoces expertos en materia tributaria de CE Consulting.
Será necesario que las obras para la mejora de la eficiencia energética  estén acreditadas por técnicos competentes y las deducciones, como recoge Gestha, son las siguientes:
Uno de los cambios es que se reduce en el ejercicio económico de 2021 ""de seis a tres meses el plazo para que las cantidades adeudadas por los arrendatarios tengan la consideración de saldo de dudoso cobro y puedan deducirse de los rendimientos íntegros del capital inmobiliario"", subrayan los técnicos de Hacienda.
Asimismo, aquellos arrendadores que no sean considerados como grandes tenedores que tengan arrendado un local a profesionales o empresarios y que hayan acordado de manera voluntaria una reducción de las mensualidades del alquiler de enero, febrero y marzo de 2021, ""pueden computar como gasto deducible la cuantía de la rebaja"", añaden.
Las personas beneficiarias del Ingreso Mínimo Vital tendrán que presentar la declaración anual del IRPF, independientemente de la cuantía de los ingresos percibidos, aunque el IMV en sí mismo ""es una renta exenta y la gran mayoría de los beneficiarios no tendrán que incluirlo en su declaración, pero sí presentar declaración"", explica la Agencia Tributaria.
Los técnicos de Hacienda detallan que esta prestación, junto con las rentas mínimas de inserción y otras ayudas económicas destinadas a colectivos en riesgo de exclusión social, está exenta. ""El límite máximo anual conjunto de 1,5 veces el IPREM, siendo este límite en 2021 de 11.862,90 euros"". En este sentido, las personas que perciban esta ayuda y los miembros de la unidad de convivencia ""están obligados a presentar la declaración"", aunque estas rentas no están sujetas a retención.",economia
Qué pagos por Bizum hay que incluir en la Declaración de la Renta 2021-2022,07:33h,06.04.2022,"
20minutos
 ","Este miércoles 6 de abril arranca la campaña de la Renta y Patrimonio correspondiente al ejercicio económico de 2021, por lo que a partir de este día los contribuyentes que tengan que presentar la declaración podrán confeccionar el borrador por Internet en el portal 'Renta 2021' habilitado por la Agencia Tributaria.
El Ministerio de Hacienda controla los movimientos de dinero y las transacciones que efectuamos, por lo que hay que rendir cuentas cada año. Pero, ¿qué sucede con los movimientos que miles de usuarios hacen cada día por aplicaciones como Bizum? ¿Hay que incluirlos en la declaración de la Renta?
Las transferencias inmediatas gracias a aplicaciones como Bizum han aumentado exponencialmente en los últimos años, ya que solo se necesita disponer del número de teléfono de la persona que envía o recibe el dinero. En este sentido, al igual que ocurre con cualquier otra transacción, los pagos que se emiten con esta 'app' también están sujetos al control fiscal.
Los bancos tienen la información de todos los movimientos realizados con Bizum, al igual que con cualquier transferencia, por lo que se lo notifican a la Agencia Tributaria si así lo requiere. Una entidad tiene la obligación de notificar al organismo público los movimientos sospechosos, esto es, aquellos que superen los 10.000 euros o que impliquen una cantidad superior a 3.000 euros en metálico.
Como detallan en el medio especializado 'La Información', la Agencia Tributaria puede solicitar al banco información sobre estas operaciones ejecutadas por la aplicación móvil, aunque los usuarios no están obligados a declarar estos movimientos. Bizum limita a 1.000 euros la cantidad máxima que se puede enviar y las normativas sobre movimientos bancarios que deben ser declarados no se les pueden aplicar a este tipo de transacciones.",economia
