Título,Hora,Fecha,Autor,Texto Completo,Categoría
Qué es el extraño anillo que han descubierto alrededor de nuestra galaxia,14:24h,07.04.2022,"
20minutos
 ","Los científicos han descubierto un anillo interior de estrellas ricas en metales, un nuevo descubrimiento muy relevante de nuestra propia galaxia, que se puede usar para conocer mejor la estructura global de esta.
El hallazgo se ha hecho usando una combinación de estrellas y un modelo realista de la Vía Láctea, gracias a los conocimientos de los científicos del Instituto Max Planck de Física Extraterrestre.
Justo fuera de la barra galáctica, descubrieron un anillo interior de estrellas ricas en metales, que son más jóvenes que las estrellas de la barra. Las edades de las estrellas del anillo se pueden usar para estimar que la barra debe haberse formado hace al menos 7 mil millones de años. La existencia de este anillo hace probable que la formación de estrellas a partir del flujo de gas jugara un papel importante en estas épocas tempranas.
Comprender la estructura global de nuestra propia galaxia es complicado por el hecho de que estamos situados cerca de uno de sus brazos espirales en el plano del disco. En muchas direcciones, las estrellas están oscurecidas por densas nubes de gas y polvo. Esto es especialmente cierto hacia el centro de la Vía Láctea, lo que hace que la estructura interna de la Vía Láctea sea particularmente esquiva.
Sin embargo, durante la última década, los científicos del Instituto Max Planck de Física Extraterrestre (MPE) han podido combinar datos de varias campañas de observación con sofisticadas simulaciones por computadora para crear un modelo de última generación de la Vía Láctea interior: una barra en movimiento lento con una protuberancia en forma de cacahuete.
Estudios recientes han producido una gran cantidad de datos nuevos para la Vía Láctea interior. APOGEE es un estudio espectroscópico estelar a gran escala realizado en longitudes de onda del infrarrojo cercano. A diferencia de la luz óptica, la luz infrarroja puede atravesar más fácilmente el polvo, lo que permite que APOGEE detecte estrellas situadas en las regiones polvorientas de la Vía Láctea, como el disco y la protuberancia, y determine no solo la abundancia de sus elementos, sino también sus posiciones, línea velocidades a la vista y edades aproximadas.
Además, la ambiciosa misión Gaia está cartografiando alrededor de mil millones de estrellas, proporcionando mediciones de posición y de movimiento propio. Juntos, ambos estudios proporcionan todos los ingredientes de observación necesarios para determinar las órbitas de las estrellas en las regiones internas de la Vía Láctea. Todo lo que se necesita es un potencial realista de la Vía Láctea para integrar las estrellas. Esto se obtiene del modelo interno de la Vía Láctea creado por los científicos de MPE.
""Integramos más de 30.000 estrellas del estudio APOGEE con datos adicionales de Gaia en nuestro potencial de protuberancia de barra de la Vía Láctea para obtener las órbitas completas de estas estrellas"", explica en un comunicado Shola M. Wylie, estudiante de doctorado MPE y autor principal del estudio. ""Y con estas órbitas, podemos ver efectivamente detrás del bulto galáctico, así como otras regiones espaciales que no están cubiertas por las encuestas"". Luego, los científicos utilizaron estas órbitas para construir mapas de la densidad estelar, la metalicidad y la edad de la Vía Láctea interior.
""Alrededor de la barra central, encontramos una estructura de anillo interior que es más rica en metales que la barra y donde las estrellas tienen edades más jóvenes, alrededor de 7.000 millones de años"", continúa. Si bien se han visto anillos internos de formación de estrellas en otras galaxias de disco, no estaba claro que nuestra galaxia de origen contenga un anillo interno estelar.
Para separar las estrellas en las estructuras de anillo y barra, los científicos utilizaron la excentricidad de las órbitas, es decir, cuánto se desvía la órbita de un círculo. Encuentran no solo que las estrellas en el anillo son más jóvenes y más ricas en metales que las estrellas en la barra, sino también que estas estrellas están más concentradas hacia el plano galáctico.
""Las estrellas en el anillo estelar deben haber seguido formándose a partir del flujo de gas después de que la barra estuvo en su lugar"", explica Ortwin Gerhard, científico principal del MPE Dynamics Group. Por lo tanto, la edad de las estrellas en el anillo interior puede usarse para mirar hacia atrás en la historia de formación de la Vía Láctea: los científicos estiman que la barra galáctica se formó hace al menos 7.000 millones de años.
Todavía no está claro si existe una conexión entre el anillo interior recién descubierto y los brazos espirales de la galaxia y si el gas se canaliza actualmente hacia el interior de un anillo interior delgado en formación de estrellas, como se ve en otras galaxias espirales. Se necesita más trabajo para comprender mejor la transición del anillo al disco circundante en la Vía Láctea, lo que requiere modelos aumentados y más datos.",ciencia
Un investigador promueve un modelo matemático para analizar los efectos del accidente nuclear de Fukushima,13:55h,07.04.2022,EUROPA PRESS,"El investigador del Centro de Investigaciones Científicas Avanzadas (CICA) de la Universidade da Coruña, Manuel López-Vicente, estudiará los efectos ambientales del accidente nuclear de Fukushima, con el apoyo de centros de investigación japoneses.
El Environmental Radioactivity Research Network Center (ERAN) concedió una ayuda a Manuel López-Vicente, investigador distinguido de la Xunta en el CICA de la UDC desde 2020, para este estudio.
Según informa la institución coruñesa, López-Vicente desarrollará modelos matemáticos que calculen como se produce el transporte de isótopos acumulados en las partículas más finas del suelo como resultado de los procesos hidrológicos superficiales.
""Esto ayudará a entender mejor la redistribución de la radioactividad, proporcionando un modelo que ayude a tomar decisiones sobre los usos y manejos del terreno, incluyendo las tareas de descontaminación o la concentración de materiales radioactivos"", explica.",ciencia
HD1: la galaxia más lejana y más antigua a 100 millones de años luz de la Tierra,12:17h,07.04.2022,"
20minutos
 ","Un equipo internacional de astrónomos ha descubierto el objeto más lejano observado hasta ahora, una galaxia que ha sido bautizada como HD1 y que está a unos 13.500 millones de años luz.
Los detalles del hallazgo se describen en la revista Astrophysical Journal, y en un artículo publicado en Monthly Notices of the Royal Astronomical Society Letters, donde los científicos plantean las primeras hipótesis sobre el tipo de galaxia que puede ser.
HD1 se descubrió tras más de 1.200 horas de observación con los telescopios Subaru, VISTA, un telescopio infrarrojo del Reino Unido y el telescopio espacial Spitzer.
Yuichi Harikane, astrónomo de la Universidad de Tokio, autor del descubrimiento declara que ""fue un trabajo muy duro encontrar HD1 entre más de 700.000 objetos"",
Entorno a su origen, equipo de astrónomos, entre los que se encuentran miembros del Centro de Astrofísica de Harvard y del Smithsonian, proponen dos teorías: que HD1 esté formando estrellas a un ritmo asombroso y que incluso contenga estrellas de la Población III -las primeras del universo- que jamás han sido observadas.
Y la segunda idea, plantea que contenga un agujero negro supermasivo con una masa cien millones de veces superior a la de nuestro Sol. Desde el centro de investigación, Fabio Pacucci, autor principal del estudio añade que ""responder a las preguntas sobre la naturaleza de una fuente tan lejana puede ser un reto"".
Pero también advierte que ""es un largo juego de análisis y exclusión de escenarios inverosímiles"" y que ""es como adivinar la nacionalidad de un barco a partir de la bandera que enarbola, estando lejos en tierra, con la nave en medio de un vendaval y una densa niebla. Uno puede ver quizá algunos colores y formas de la bandera, pero no en su totalidad.""
Hasta el momento, lo que se sabe de HD1 es que es extremadamente brillante en luz ultravioleta, lo que significa, en palabras de Pacucci, que ""algunos procesos energéticos están ocurriendo allí o, mejor aún, ocurrieron hace algunos miles de millones de años"".
En un principio se pensó que HD1 era una galaxia estándar y que estaba creando estrellas a un ritmo alto. Tras diversos cálculos comprobaron que HD1 produce las estrellas a ""un ritmo increíble"" superior a las cien estrellas por año. Un dato ""al menos 10 veces superior a lo que esperamos para estas galaxias"", declararon los astrónomos en su investigación.
A partir de aquí, el estudio cambió de rumbo y empezaron las sospechas de que HD1 podría no estar formando estrellas normales y corrientes. ""La primera población de estrellas que se formó en el universo era más masiva, más luminosa y más caliente que las estrellas modernas"", dice Pacucci.
La clave eran las estrella de la Población III, las cuales según Pacucci ""son capaces de producir más luz ultravioleta que las estrellas normales, lo que podría aclarar la extrema luminosidad ultravioleta de HD1"" y por tanto asumiendo esta premisa ""sus propiedades podrían explicarse más fácilmente"".
Esta no es la única explicación que se encontró durante el estudio. También se determinó que la extrema luminosidad de HD1 bien podría ser la existencia de un agujero negro supermasivo, que al engullir grandes cantidades de gas, podría emitir fotones de alta energía.
Siguiendo esta teoría, este sería el agujero negro supermasivo más temprano conocido por la humanidad, mas cercano en el tiempo que el Big Bang.
Avi Loeb, coautor del estudio explica que ""HD1 representaría un bebé gigante en la sala de partos del universo primitivo"" y añade que ""en HD1 debe haber crecido a partir de una semilla masiva a una velocidad sin precedentes. Una vez más, la naturaleza parece ser más imaginativa que nosotros""
HD1 se encuentra a 100 millones de años luz más lejana que GN-z11, la que hasta ahora era la galaxia más lejana. Unos parámetros constatados tras observaciones de seguimiento con el telescopio Atacama Large Millimeter/submillimeter Array o ALMA.
Ahora, otro telescopio espacial, el James Webb, volverá a observar HD1 para verificar su distancia a la Tierra y si los cálculos actuales son correctos. De confirmarse estaríamos hablando de la galaxia más lejana y más antigua jamás encontrada.",ciencia
El dinosaurio cojo que dejó sus huellas en la serranía de Cuenca,03:22h,07.04.2022,EFE,"Hace 129 millones de años caminaba por la serranía de Cuenca un dinosaurio terópodo (bípedo). Lo que hace especial a este ejemplar es que tenía un pie herido o con alguna malformación, que dejó plasmada en sus huellas, las cuales han sido estudiadas por un grupo de científicos españoles.
La investigación que publica la revista Plos y está encabezada por Carlos Herrera-Castillo de la Universidad Autónoma de Madrid, encuentra en las huellas evidencias de ese problema en la pata del animal y cómo adoptó una marcha anormal en respuesta esa lesión.
El rastro está compuesto por un conjunto de seis huellas que se encuentra en el yacimiento paleontológico de Las Hoyas y fue dejado por un tipo no identificado de terópodo, al que pertenecen algunas de las especies más famosas de dinosaruios, como el tyrannosaurus rex o el velociraptor, que caminaban sobre las patas traseras y tenían dientes afilados para la caza.
Las huellas fósiles son una buena fuente de información sobre el comportamiento de los animales extinguidos, y los autores usaron diversas técnicas para describir y modelar los restos para compararlas con otros.
El rastro dejado por el pie derecho muestra tres dedos, pero en el pie izquierdo el dedo más interno está representado por marcas extremadamente cortas y de forma irregular en el sedimento, lo que indica una lesión o deformidad.
Además, las huellas están más espaciadas que las típicas de los terópodos, lo que indica que este dinosaurio ajustó su marcha para compensar su pie lesionado, teoría reforzada por ciertas deformaciones en las huellas de la derecha, que sugieren que el animal ponía más peso en ese lado.
Los autores señalan que también se observan deformidades similares en los dedos de los pies y comportamientos compensatorios parecidos en las aves modernas, y que los pies fósiles de terópodos se encuentran a menudo con lesiones en los dedos más internos.
En conjunto, estas pruebas arrojan luz sobre cómo este dinosaurio, y tal vez muchos otros, encontraron formas de sobrevivir a pesar de los reveses patológicos, según los autores.
El dinosaurio dejó su rastro mientras caminaba lentamente, a unos cuatro kilómetros por hora, por una zona de aguas poco profundas hacia la fuente de agua principal.
En la investigación han participado también el Instituto Geológico y Minero de España y la Universidad de Barcelona.",ciencia
"""Ya hemos logrado que el tacto se sienta a distancia; ahora vamos a trabajar para enviar las emociones""",12:55h,05.04.2022,"
Araceli Guede
 
Jorge París
 
Bieito Álvarez
 ","La última vez que hablamos con Isaac Castro, el mundo desconocía que se avecinaba una pandemia que iba a tener a la población confinada durante meses. Poco podía imaginar este ingeniero de telecomunicaciones que el proyecto en el que trabajaba junto a su equipo iba a adquirir más sentido aún si cabe. La idea de poder sentir el tacto a distancia, surgida de vivir a miles de kilómetros de casa, pasaría en tan solo unas semanas a cobrar especial dimensión en un momento en el que la separación interpersonal y el encierro se impusieron como medidas para combatir la covid. Entonces Emerge Home estaba a punto de empezar a ser probado por una comunidad de desarrolladores. Hoy, dos años después de aquella entrevista, comienza a estar a disposición de los consumidores.
""La pandemia nos puso a todos en una misma situación y nos ha ayudado a que la gente entendiera  un poco más qué es sentirse desconectado de las personas que te importan y cuál es el valor del tacto"", explica Castro, mientras monta el dispositivo en la redacción de 20minutos. Hace unos días que llegó a España desde Los Ángeles, donde reside y donde está la sede de la startup, con el objetivo de presentar también aquí su desarrollo. ""La primera vez que lo utilicé con mi madre lloró"", recuerda este madrileño de Móstoles, de 37 años y que vive fuera del país prácticamente desde que acabó sus estudios universitarios.
Sin mandos ni guantes, una placa colocada ante el usuario genera un campo de fuerza usando ondas ultrasonoras mientras las gafas de realidad aumentada le introducen en el metaverso. Las ondas no se ven pero se sienten en el aire, de forma similar a como se sienten las vibraciones de la música a través de un altavoz. En ese contexto la sugestión juega también un papel importante. Creando un escenario propicio, el cerebro tiende a convencerse de que realmente tiene delante de sí los objetos virtuales que está viendo.
Además de contribuir a la cercanía entre personas, esta plataforma tendrá usos en otras tres materias: entretenimiento, educación y salud mental. ""El tacto nos ayuda a desarrollarnos como humanos, nos permite crear vínculos y expresar nuestras emociones y tiene grandes beneficios para nuestra salud. Muchos estudios describen cómo nos ayuda a aliviar la ansiedad, la soledad, la depresión e incluso el dolor físico. Activa parte de la corteza orbitofrontal del cerebro y estimula la producción de oxitocina, lo que los científicos llaman la hormona del cuidado y la conexión"", manifiesta este emprendedor y hace referencia a una encuesta previa a la pandemia que reflejaba que el 79% de la Generación Z, el 71% de los millennials y el 50% de los baby boomers se sentían  solos. Todo parece indicar que la situación provocada por el coronavirus no ha hecho más que empeorar esos datos.
""Los expertos están muy preocupados por las implicaciones en nuestra salud mental ocasionadas por la carencia de tacto debido a nuestra tecnología y contexto actuales. Muchos estudios hablan de la importancia del tacto para pacientes con demencia en general y con Alzhéimer en particular, y de cómo ayuda a reducir o retrasar los síntomas de la enfermedad. En entornos inmersivos nos ayudará además a sentirnos más presentes y empatizar más con otros, en lugar de lo que ocurre hoy en día en las redes sociales, donde a menudo nos refugiamos detrás de un nombre y una foto"", continúa.
Emerge Home permite crear ""círculos cercanos"" de hasta ocho miembros, personas de confianza del usuario que, en aras de la privacidad y la seguridad, deberán contar con invitación expresa para poder entrar. Su planteamiento no es recrear con exactitud las texturas ni la dureza de los materiales sino ""cómo sería el sentido del tacto en un mundo de hologramas"". En esa línea, se nota algo similar a la caricia de una brisa cuando las manos de los avatares se juntan o se percibe cierto peso al mover las piezas en una partida de ajedrez. El poder interactuar directamente con las manos impulsa la experiencia.
""Una de las cosas que teníamos clara es que queríamos crear una experiencia sin fricciones, que fuera natural e intuitiva. No queríamos crear una empresa con guantes ópticos. De la misma forma creemos que la realidad aumentada cada vez se verá más liberada de aparatos grandes. Empezarán a crearse gafas más ligeras, incluso lentes de contacto, y en algún momento, será una conexión de cerebro a cerebro"", augura el cofundador de Emerge. Porque con ""un progreso en crecimiento exponencial"", él se muestra convencido de que la tecnología tiene aún mucho potencial. Lo que hace falta es que los emprendedores cuenten con ""el apoyo de las grandes empresas y de los gobiernos"".
""Nosotros tenemos la mente puesta en cómo continuar. Ya hemos logrado que el tacto se sienta a distancia. Ahora vamos a trabajar para enviar las emociones. En primer lugar queremos empezar a entenderlas y para conseguirlo hay muchas cosas que puedes analizar en tu cuerpo, tus expresiones, tus movimientos, tu entonación de voz..."", cuenta Castro que no se detiene ahí: ""En un futuro, que también forma parte de nuestro plan, podremos conectar nuestros cerebros. Esta sería la forma más efectiva para comunicar nuestras emociones"".",ciencia
Identificadas 75 regiones del genoma asociadas a la enfermedad de Alzheimer,21:14h,04.04.2022,EFE,"Un equipo internacional de investigadores ha identificado 75 regiones del genoma asociadas al alzheimer, 42 de las cuales nunca se habían relacionado con esta enfermedad. El hallazgo es esencial para mejorar la comprensión y el tratamiento del alzheimer.
Los detalles del estudio, realizado por investigadores de Europa, Estados Unidos y Australia y publicados este lunes en la revista Nature Genetics, aportan nueva información sobre los mecanismos biológicos involucrados y abren nuevas vías de tratamiento y diagnóstico.
El alzheimer -la forma más común de demencia- es una patología compleja y multifactorial que afecta a más de un millón de personas en España, según datos de la Confederación Española de Alzheimer (CEAFA).
Esta enfermedad sin cura suele aparecer después de los 65 años y tiene un fuerte componente genético. Se cree que la mayoría de los casos están causados por la interacción de factores genéticos con factores ambientales.
Para comprender mejor los orígenes de la enfermedad, uno de los principales retos de la investigación es caracterizar mejor sus factores de riesgo genéticos, identificando los procesos fisiopatológicos en juego, y proponer así nuevas dianas terapéuticas.
En este trabajo, coordinado por el director de investigación del Instituto Nacional de Salud e Investigación Médica de Francia (Inserm), Jean-Charles Lambert, los autores hicieron un estudio de asociación de todo el genoma (GWAS) sobre el mayor grupo de pacientes de alzheimer creado hasta la fecha.
Estos estudios consisten en analizar el genoma completo de decenas de miles o cientos de miles de individuos, sanos o enfermos, para identificar factores de riesgo genético asociados a aspectos concretos de la enfermedad.
El método permitió identificar 75 regiones (loci) del genoma asociadas al alzheimer, 42 de ellas nuevas.
""Tras este importante descubrimiento, caracterizamos estas regiones para darles un significado en relación con nuestros conocimientos clínicos y biológicos, y así comprender mejor los mecanismos celulares y los procesos patológicos en juego"", explica Lambert.
En la enfermedad de Alzheimer, hay dos fenómenos cerebrales patológicos que se conocen bien: la acumulación de péptidos beta-amiloides y la modificación de la proteína Tau, cuyos agregados se encuentran en las neuronas.
Este estudio, en el que también participan científicos españoles, constató la importancia de ambos procesos, ya que al analizar las distintas regiones del genoma confirmaron que algunas están implicadas en la producción de péptidos amiloides y en la función de la proteína Tau.
También descubrieron que en la enfermedad de Alzheimer hay una disfunción de la inmunidad innata y de la acción de la microglía (células inmunitarias del sistema nervioso central que actúan de ""recolector de basura"" eliminando las sustancias tóxicas).
Por último, el estudio demostró por primera vez que la vía de señalización dependiente del factor de necrosis tumoral alfa (TNF-alfa) está implicada en la enfermedad.
Todos estos hallazgos confirman y amplían los conocimientos actuales sobre los procesos patológicos implicados en la enfermedad y abren nuevas vías de investigación terapéutica.
A partir de los hallazgos del estudio, los investigadores también idearon una puntuación de riesgo genético para evaluar mejor qué pacientes con deterioro cognitivo desarrollarán, en los tres años siguientes a su manifestación clínica, la enfermedad de Alzheimer.
""Aunque esta herramienta no está pensada para su uso en la práctica clínica en la actualidad, podría ser muy útil a la hora de establecer ensayos terapéuticos para clasificar a los participantes según el riesgo y mejorar la evaluación de los medicamentos que se están probando"", detalla Lambert.
Para validar y ampliar sus hallazgos, el equipo continuará su investigación en un grupo aún más amplio y diverso, dado que la investigación genética se ha realizado, principalmente en poblaciones caucásicas.",ciencia
